event_id,expected_answer_date,meeting_date,approved_date,name,party,mp_area,item_text,flag,topic_area,action,notes
S6W-28496,2024-08-01T00:00:00Z,NA,2024-07-04T16:02:42Z,Katy Clark,Scottish Labour,West Scotland,To ask the Scottish Government what discussions it has had with NHS boards regarding the potential integration of new health technology platforms.,TRUE,primary_care_gp,information,
S6W-28491,2024-08-01T00:00:00Z,NA,2024-07-04T16:02:42Z,Foysol Choudhury,Scottish Labour,Lothian,"To ask the Scottish Government, in light of the housing emergency, what action it is taking to ensure that child refugees arriving in Scotland through family reunification (a) have access to suitable housing and (b) are not required to present as homeless and stay in temporary accommodation for extended periods.",TRUE,hsc,information,
S6W-28492,2024-08-01T00:00:00Z,NA,2024-07-04T16:02:42Z,Katy Clark,Scottish Labour,West Scotland,To ask the Scottish Government what its position is on NHS boards registering with the Apple Health platform.,TRUE,primary_care_gp,information,
S6W-28497,2024-08-02T00:00:00Z,NA,2024-07-05T09:41:30Z,Emma Harper,Scottish National Party,South Scotland,To ask the Scottish Government when ministers will be in a position to provide an update to the Parliament on the work of the Chief Medical Officers office to review the recommendations of the Cass Review and its implications for Scotland.,TRUE,gic,information,
S6W-28502,2024-08-05T00:00:00Z,NA,2024-07-08T12:28:15Z,Ruth Maguire,Scottish National Party,Cunninghame South,To ask the Scottish Government what it is doing to respond to reported concerns by bereaved families and victim organisations regarding media coverage of child homicide victims.,FALSE,mhsa,information,"This question has also been sent to the Pregnancy, Birth & Child Health team for information. "
S6W-28502,2024-08-05T00:00:00Z,NA,2024-07-08T12:28:15Z,Ruth Maguire,Scottish National Party,Cunninghame South,To ask the Scottish Government what it is doing to respond to reported concerns by bereaved families and victim organisations regarding media coverage of child homicide victims.,FALSE,preg_birth_child,information,This question has also been sent to the Mental Health & Service Access team for information.
